{
  "schema": "subactor.living-failure/v1",
  "projectId": "autonomy-example",
  "failureId": "7b5ad869-e591-450b-8d0c-f0f5c57a61d9",
  "traceId": "482122ca-703b-4785-baee-8519fe20d16b",
  "occurredAt": "2026-08-06T20:17:56.151Z",
  "configPath": "/home/tom/github/bioxfoundry/twin-dsl/.autonomy-demo/project/project.projectdsl",
  "outputDirectory": "/home/tom/github/bioxfoundry/twin-dsl/.autonomy-demo/runtime",
  "consecutiveFailures": 1,
  "errorCode": "EXAMPLE_CONNECTOR_FAILURE",
  "message": "EXAMPLE_CONNECTOR_FAILURE",
  "retryAfterMs": 1000
}
